{
  "spec_version": "1.0.0",
  "scene_id": "living_room_black_wood_gold_boutique",
  "scene_type": "living_room",
  "style_id": "black_wood_gold_boutique",
  "mood": [
    "boutique urbano",
    "moody legivel",
    "fim de tarde ambar",
    "premium compacto",
    "dramatico sem caverna"
  ],
  "palette": [
    "cinza_fumo_quente",
    "porcelanato_cimento_grafite",
    "preto_marcenaria",
    "greige_boucle",
    "couro_grafite_slate",
    "nogueira_ambar",
    "couro_conhaque",
    "champagne_escovado"
  ],
  "room_dimensions": {
    "width_m": 5.2,
    "depth_m": 4.2,
    "height_m": 2.7,
    "main_wall": "east",
    "note": "footprint REAL do r002 da planta_74 (bbox 5.17x4.24m, estar ao sul); main_wall leste = parede do rack/painel, encarando o vidro oeste (diretriz: madeira acende ambar no sol da tarde)"
  },
  "openings": [
    {
      "id": "portavidro_terraco",
      "wall": "west",
      "type": "window",
      "center_along_m": 2.1,
      "width_m": 2.8,
      "sill_m": 0.05,
      "head_m": 2.3,
      "note": "porta-vidro pro terraco (h_o011 glazed_balcony no PDF) — o vao de luz natural oeste"
    },
    {
      "id": "passagem_norte",
      "wall": "north",
      "type": "door",
      "center_along_m": 2.8,
      "width_m": 1.2,
      "sill_m": 0.0,
      "head_m": 2.1,
      "note": "vao esquematico pro jantar/hall (open-plan real: sem parede fisica; representado a leste pra circulacao)"
    }
  ],
  "hero_piece": "sofa",
  "furniture_intents": [
    {
      "type": "sofa",
      "role": "hero",
      "style_family": "dark_lounge",
      "style_family_variant": "straight",
      "dimensions_m": {
        "width": 2.1,
        "depth": 0.95,
        "height": 0.78
      },
      "material_style": "hero_fabric",
      "placement_hint": "main_wall",
      "priority": 1,
      "notes": "arquetipo VENEZIA (LP-SOFA-001): assento profundo, bracos contidos, encosto baixo ~10deg, pes finos metal preto — o builder ja carrega backrest_rake=10 e cushion_bevel lockados"
    },
    {
      "type": "rug",
      "role": "anchor",
      "style_family": "flat_woven",
      "dimensions_m": {
        "width": 3.0,
        "depth": 2.2
      },
      "material_style": "rug",
      "placement_hint": "centered_under_hero",
      "priority": 2,
      "notes": "greige QUENTE grande, pes dianteiros do sofa em cima — anti-caverna estrutural (separa sofa grafite do piso grafite)"
    },
    {
      "type": "coffee_table",
      "role": "companion",
      "style_family": "low_slab",
      "dimensions_m": {
        "width": 1.25,
        "depth": 0.7,
        "height": 0.36
      },
      "material_style": "table_top",
      "placement_hint": "front_of_hero",
      "priority": 3,
      "notes": "pedra preta MATE LISA (sem veio — veio dourado e exclusivo do backsplash da cozinha), base metal preto fino"
    },
    {
      "type": "wall_art",
      "role": "decor",
      "style_family": "abstract_panel",
      "dimensions_m": {
        "width": 1.3,
        "depth": 0.05,
        "height": 0.9
      },
      "material_style": "art_canvas",
      "placement_hint": "above_hero",
      "priority": 5,
      "notes": "UNICA arte grande da sala, abstrato terroso — nao galeria"
    },
    {
      "type": "curtain",
      "role": "textile",
      "style_family": "soft_panel",
      "material_style": "curtain",
      "placement_hint": "on_window",
      "priority": 6,
      "panel_split": 2,
      "panel_w": 0.45,
      "notes": "sheer linho greige piso-teto emoldurando o vao oeste — difusor do sol da tarde (risco #2 da diretriz)"
    },
    {
      "type": "accent_seat",
      "role": "companion",
      "style_family": "leather_lounge",
      "dimensions_m": {
        "width": 0.78,
        "depth": 0.82,
        "height": 0.72
      },
      "material_style": "accent_fabric",
      "placement_hint": "opposite_hero",
      "priority": 7,
      "notes": "poltrona couro CONHAQUE dessaturado girada pro eixo do sofa — a injecao de calor da sala (warmth_check)"
    },
    {
      "type": "side_table",
      "role": "companion",
      "style_family": "slim_metal_round",
      "dimensions_m": {
        "width": 0.38,
        "depth": 0.38,
        "height": 0.52
      },
      "material_style": "wood_accent",
      "placement_hint": "beside_hero",
      "priority": 8,
      "notes": "tampo nogueira ambar + base metal preto — madeira como pontuacao"
    },
    {
      "type": "floor_lamp",
      "role": "light",
      "style_family": "slim_metal",
      "dimensions_m": {
        "width": 0.36,
        "depth": 0.36,
        "height": 1.62
      },
      "material_style": "metal_accent",
      "placement_hint": "beside_hero",
      "priority": 9,
      "notes": "haste preta fina + cupula champagne escovado = O ponto unico de bronze da sala (D4)"
    },
    {
      "type": "plant_placeholder",
      "role": "decor",
      "style_family": "leafy_volume",
      "dimensions_m": {
        "width": 0.5,
        "depth": 0.5,
        "height": 1.55
      },
      "material_style": "plant_green",
      "placement_hint": "near_window",
      "priority": 10,
      "notes": "ficus/oliveira folha ESCURA em vaso ceramica preta fosca junto ao vidro oeste",
      "window_side": "plus"
    }
  ],
  "composition_rules": [
    "hero_on_main_wall",
    "rug_centered_under_hero",
    "coffee_table_0p35_0p45_from_hero",
    "art_centered_above_hero",
    "curtain_on_window",
    "curtain_open_panels_framing_not_protagonist",
    "accent_seat_opposite_hero",
    "balanced_mass_per_quadrant",
    "side_table_beside_hero",
    "floor_lamp_beside_hero",
    "plant_near_window",
    "keep_circulation_0p7"
  ],
  "camera_goal": {
    "kind": "three_quarter_human",
    "eye_height_m": 1.6,
    "subject": "hero_seating_zone",
    "min_hero_coverage": 0.1
  },
  "render_goal": {
    "views": [
      "top",
      "three_quarter",
      "contact_sheet"
    ],
    "mood_keywords": [
      "moody_legivel",
      "warm_2700k",
      "amber_wood",
      "premium_compact"
    ],
    "notes": "V-Ray so depois do SpatialGate (regra do track). Luz: sol oeste difundido pela sheer + LED wash 2700K no rack (diretriz variante B do interior-designer 2026-07-11)."
  }
}